{
  "schema_version": 1,
  "status": "complete",
  "source_file": "010-source.md",
  "output_file": "010-output.md",
  "source_sha256": "0000000000000000000000000000000000000000000000000000000000000000",
  "output_sha256": "0000000000000000000000000000000000000000000000000000000000000000",
  "visual_plan_sha256": "0000000000000000000000000000000000000000000000000000000000000000",
  "topics": [{
    "topic_slug": "planejamento-da-auditoria",
    "selected_variants": [{"resource":"mermaid","semantic_role":"process_flow","variant_family":"linear-stages"}],
    "requirements": [{"resource":"mermaid","semantic_role":"process_flow","required":true,"minimum":1,"maximum":1}],
    "observed_resources": [{"resource":"mermaid","count":1},{"resource":"highlight","count":1}],
    "violations": []
  }]
}
